{"name":"Level 1","origin":[5,5],"layout":[{"material":"images/grass-block.png"},{"material":"images/stone-block.png","reverse":true,"speed":1.2,"enemies":[{"delay":1,"type":["ClassicCar","Taxi","MuscleCar","Van","Pickup"]},{"delay":8,"type":["SportsCar"]},{"delay":4,"type":["ClassicCar","Taxi","MuscleCar","Van"]}]},{"material":"images/stone-block.png","speed":2,"enemies":[{"delay":1,"type":["ClassicCar","Taxi","Van"]},{"delay":3,"type":["Taxi","Truck","Van","Pickup"]},{"delay":7,"type":["MuscleCar","Taxi","Truck","Van"]}]},{"material":"images/stone-block.png","speed":2,"enemies":[{"delay":3,"type":["Police"]},{"delay":6,"type":["Police"]}]},{"material":"images/grass-block.png","speed":1.4,"enemies":[{"delay":1,"type":["Bug"]},{"delay":4,"type":["Bug"]},{"delay":6,"type":["Bug"]},{"delay":9,"type":["Bug"]}]},{"material":"images/grass-block.png"}],"startFrame":4}