{"name":"Level 3","origin":[5,5],"layout":[{"material":"images/water-block.png"},{"material":"images/stone-block.png","reverse":true,"speed":3,"enemies":[{"delay":1,"mode":1,"type":["SportsCar"]},{"delay":4,"mode":1,"type":["Police"]},{"delay":6,"mode":1,"type":["Police"]},{"delay":8,"mode":1,"type":["Police"]}]},{"material":"images/stone-block.png","reverse":true,"speed":1.6,"enemies":[{"delay":1,"type":["ClassicCar","Taxi","MuscleCar","Van","Pickup"]},{"delay":4,"type":["Truck","Van","Pickup"]},{"delay":8,"type":["ClassicCar","Taxi","MuscleCar","Van"]}]},{"material":"images/stone-block.png","speed":2,"enemies":[{"delay":3,"type":["Police"]},{"delay":5,"type":["Police"]},{"delay":8,"type":["Truck","Van","Pickup"]}]},{"material":"images/stone-block.png","speed":2.6,"enemies":[{"delay":1,"mode":1,"type":["SportsCar"]},{"delay":6,"mode":1,"type":["Police"]}]},{"material":"images/stone-block.png"}],"startFrame":4}